Name,Label,Comment,NonImportant,portion,service,environment,price,food_quality
金一排骨,台式,我是嘉義人，吃了那麼多家便當都不錯，今天想說來吃沒有吃過的便當店，結果是我大錯的選擇，來金一排骨便當店吃，我點了紅燒牛肉飯，一個145元，肉非常少，又難吃又要等很久，等客人說為什麼那麼久才會給客人，等我拿到要走了，走到對面發現沒有給餐具，給我太失望了，不會再吃第二次了，這樣的店既然還會有客人，菜不好吃，又貴，服務態度冷冷的，本來不想給星的，沒辦法不給星他不給你發咘,0,0,0,0,0,0
金一排骨,台式,"到底是在吃什麼？？？？？？
點菜老闆在補妝
菜沒味道 主餐也很糟糕 …",0,0,0,0,0,0
金一排骨,台式,"1、傻眼沒辦法找零錢說星期六換不到。
2、態度冷淡，進門後要點餐竟然要我等40秒才冷淡走來。
3、價格貴且無服務，非常不推薦。",0,0,0,0,0,0
金一排骨,台式,東西很普通，但是卻非常貴，普通的自助餐都比它便宜好吃，服務人員的臉就像便秘了十天拉出來的屎一樣臭得要命，為什麼這種店都不會倒？？,0,0,0,0,0,0
金一排骨,台式,"老闆娘臉很臭
東西不難吃但是沒有值到那個價錢
少40元我可能才會想再去吃",0,0,0,0,0,0
老牌港式生滾粥,港式,"鍋燒烏龍很好吃，料多湯頭也很好！
今天訂熊貓兩筆，其中一筆被取消，店家很貼心留字條告知因少材料才取消。",0,0,0,0,0,0
欣葉牛排,台式,"雞排非常小塊 麵也很少
店員動作非常慢 餐包沒有味道
點雞排還送魚刺
說實在的 第一次吃到這麼多值得吐槽的店",0,0,0,0,0,0
欣葉牛排,台式,服務態度差到不行耶 真的不明白為何要用這種態度做生意？！都還沒跟貴餐廳點餐就用很差的口氣說話⋯實在是非常讓人不爽 只能幫貴餐廳差評回應,0,0,0,0,0,0
欣葉牛排,台式,收銀台的小姐態度很差,0,0,0,0,0,0
欣葉牛排,台式,"電話預訂口氣
有夠差還沒點完就一直問要什麼醬",0,0,0,0,0,0
欣葉牛排,台式,店員搞不清狀況，且待客態度極差,0,0,0,0,0,0
昇炸焱泰式料理/炸物,東南亞,出菜速度和服務都很好，菜色口感雖然「泰皮台骨」，但大部分也不錯吃，唯炒飯系列口感比較讓人失望。,0,0,0,0,0,0
昇炸焱泰式料理/炸物,東南亞,沒看過異國料理能在地化這麼完全的，嚴重懷疑廚師把鹽巴拿成糖，每道菜除了甜沒其他印象點，5-6人套餐的量4個人吃差不多，哪些餐點沒上連服務員都不知道，出餐管理服務品質有待加強,0,0,0,0,0,0
昇炸焱泰式料理/炸物,東南亞,餐點口味算中上！泰奶也不會太甜 蠻好喝的！出餐速度也還行！但服務員的態度 有夠差 帶位很像在叫狗一樣 用比的 到了位置上 菜單直接用丟的丟桌上 然後人就走掉了！來點餐的時候也是扯爆 愛點不點的 附送餐點完全念給他自己聽 完全聽不懂在唸什麼 不知道在跩什麼,0,0,0,0,0,0
昇炸焱泰式料理/炸物,東南亞,"2022/12/24
上菜速度超快
很神奇 …",0,0,0,0,0,0
家玲妹便當,台式,普通的便當菜，服務偏差,0,0,0,0,0,0
月見町拉麵 (嘉義東義店),日式,"胖胖的女店員態度有夠差
態度不改的話就等著倒閉吧
生意不可能做的起來",0,0,0,0,0,0
月見町拉麵 (嘉義東義店),日式,服務態度很差，比我們晚點餐的都已經上菜了，完全忘了我們的餐點，跟店家詢問後只回：「就忘了」，一句抱歉也沒有，讓人傻眼🙄，要不是一定要按，一顆星也不想給，第一次遇到做生意態度這樣的⋯ …,0,0,0,0,0,0
月見町拉麵 (嘉義東義店),日式,老闆態度不知道是在差幾點，買個麵不用搞的全家欠你錢一樣欸,0,0,0,0,0,0
月見町拉麵 (嘉義東義店),日式,"是拿病死豬煮湯嗎？ 豬腥味太可怕
整碗還給老闆 請他自己好好檢討",0,0,0,0,0,0
月見町拉麵 (嘉義東義店),日式,豚骨拉麵湯頭有類似臭豆腐的味道有夠難吃讓我吃完馬上去拉肚子這個味道讓我難以忘懷～服務品質還可以,0,0,0,0,0,0
月見町拉麵 (嘉義東義店),日式,"服務可以，湯頭不行，比路邊攤的陽春麵還沒味道...

付錢吃麵不如把錢捐出去
0",0,0,0,0,0,0
喜粵樓-平價料理 (嘉義店),台式,菜品少，補菜慢，有些菜都不熱，一人550元的晚餐buffet ，真的有夠爛，感覺很不用心，還有人會寫推薦文，根本就是業配文，希望看到的朋友，千萬不要去吃。👎👎👎 …,0,0,0,0,0,0
喜粵樓-平價料理 (嘉義店),台式,"辦喜宴服務生超級少，主管談喜宴事務時很熱情，喜宴當天居然變一張臉，態度超級差！連其他縣市請的主持人第一次接觸都問我怎麼這間主管態度這麼差！
說好的要佈置前面收禮金的景，當天早上前一小時到場才發現什麼也沒有！
菜色也沒有那個CP值，主管一臉臭臉，菜的上菜速度也管理不當，明顯人員少出菜根本來不及。
到現在想到都還很生氣，現在居然fb發文說是新店，真的讓人很傻眼，希望是主管換掉後的重新出發。",0,0,0,0,0,0
喜粵樓-平價料理 (嘉義店),台式,"店內加起來的品項不會超過15種，這樣的水準叫港式吃到飽
摸摸良心吧老闆，一個人收550，讓客人吃的是什麼菜色，當你的員工也很可憐！要面對一堆看到爛菜色生氣的客人..",0,0,0,0,0,0
喜粵樓-平價料理 (嘉義店),台式,說真的連一顆星都沒的極差用餐，食材少、不新鮮、收費高，毫無CP值，前日帶朋友來，看到外面的食材相片廣告，真正。一進去先收費再用餐，什麼東東啊~能吃嗎？問老闆，食材就這些，再問有茶、蛋糕嗎？哈哈哈😄幸好有問，才拿現泡茶、出一小盤來。要不，還真不知道要吃啥，更可笑的是我們一群7個人，只出一盤，幾個泡芙，幾小塊蛋糕，我們幾個分不過分吧！竟然在我們用餐中將盤子整個拿到食物區，多噁啊~我們吃了吔，沒品到極致 …,0,0,0,0,0,0
喜粵樓-平價料理 (嘉義店),台式,沒什麼東西可以吃，而且菜單上雖說都可以點，真正跟店員點的時候卻幾乎都不供應。傻眼，收費一個人＄550居然只吃了炒時蔬跟柳橙汁喝到飽。🙄🙄🙄 …,0,0,0,0,0,0
喜粵樓-平價料理 (嘉義店),台式,"真是一家差勁的餐廳
現況與網路廣告差距太大,一半以上的菜都是冷凍食品加熱，出菜有夠慢還限時，都沒食物給可人吃還要限制吃飯時間，這家港式飲茶更本就是廉價菜色、高收費，列為永遠拒絕再來的餐廳",0,0,0,0,0,0
喜粵樓-平價料理 (嘉義店),台式,忘了先看評論就來，花了500元來找罪受。食材少、上菜速度慢，菜都是冷的，只有湯和剛上的食材是熱的。超級不推啊！,0,0,0,0,0,0
喜粵樓-平價料理 (嘉義店),台式,阿哈哈哈我就是那個沒看評論就踩雷的客人，吃完就知道為什麼他們會要求先結帳才能入座，因為他們怕客人吃到一半翻臉走人⋯⋯不停網友眼吃虧在眼前,0,0,0,0,0,0
喜粵樓-平價料理 (嘉義店),台式,食材不新鮮而且都不熱、飲料只提供沒有什麼味道的洛神花茶、菜品很少、補菜速度超級慢（催了很多次）、港式點心都很難吃⋯,0,0,0,0,0,0
喜粵樓-平價料理 (嘉義店),台式,"這家好雷，根本就是買廣告
東西少，東西難吃，價位高，餐具不乾淨，服務人員ㄧ問三不知～我們一家人今天不是吃飽而是氣飽的！",0,0,0,0,0,0
喜粵樓-平價料理 (嘉義店),台式,"速度慢，員工少，裡面沒坐滿，等了半小時才上炒飯，炒麵跟一組燒賣……
等超久，菜也不是很熱，口味就……",0,0,0,0,0,0
喜粵樓-平價料理 (嘉義店),台式,"廣告不實
板子上寫著""幼稚園免費""，但幼稚園小朋友超過110公分以上要收費
所以小班中班超過110公分都要收費了？
那幹嘛還要多補充""幼稚園免費""!!",0,0,0,0,0,0
喜粵樓-平價料理 (嘉義店),台式,明明是港式飲茶卻沒有港式飲茶的菜。菜色少又補充慢，吃都吃不飽、收費收緊緊。列入永久黑名單,0,0,0,0,0,0
喜粵樓-平價料理 (嘉義店),台式,旅遊時到此吃中餐，匆忙中店名也沒注意，要不是谷歌地圖出現到此一遊， 還真的不知道店名叫什麼，CP值普通。,0,0,0,0,0,0
喜粵樓-平價料理 (嘉義店),台式,上菜速度慢，完全沒有服務生，不知道是怎麽經營過來的,0,0,0,0,0,0
禾豐鐵板燒 (家樂福嘉義店),台式,"我不會說他難吃，但也不會推薦給朋友，只能說他的餐點很普通，或是普通到底了。
不過我比較在意的是，服務態度••••我只能說有很大的努力改善空間。
總結，就是不可能再去了。",0,0,0,0,0,0
禾豐鐵板燒 (家樂福嘉義店),台式,10/25下午點完餐、去盛飯時…發現飯有異味，我立馬告知主廚，我問為何飯有問題沒有發現，得到回答是…今天沒有客人反應，另一名廚師有立刻把飯拿進去做處理，處理時間超級久，久到我的菜、肉全都上，過程大概10～20分鐘，晚點都上我快吃完了，飯才出來。重點，點來的菜超級鹹，我很難不去想像這是在針對我嗎🤔，最後廚師《只有說飯來了》，連一句抱歉什麼的都沒有。 …,0,0,0,0,0,0
禾豐鐵板燒 (家樂福嘉義店),台式,服務生上菜用摔的，結果湯汁灑出來弄到手機，服務生當作沒看到，沒道歉就算了，還直接走人，食物新鮮度差，以後絕對不會再光顧了( ･᷄ὢ･᷅ ),0,0,0,0,0,0
禾豐鐵板燒 (家樂福嘉義店),台式,"飯看起來黃吃起來很乾，但明明不是糙米飯🤔肉吃起來口感也怪怪的，很ㄌㄨㄣ！
主廚對女服務員態度很差，看起來是年紀輕輕的工讀生，覺得沒有必要這樣，兇她的時候還把口罩拿下來大喊==好噁心，其他顧客實在尷尬到不行
再也不會光顧 …",0,0,0,0,0,0
禾豐鐵板燒 (家樂福嘉義店),台式,"花了幾百塊，吃了比路邊攤更普通的品質。
男女服務生會直接在你面前打鬧、婊國罵，
面對客人問題時 卻又惜字如金 …",0,0,0,0,0,0
禾豐鐵板燒 (家樂福嘉義店),台式,"臉臭到一個不行啊⋯⋯醬瓶不是讓你這樣摔的
這種服務「質」
一輩子 大概就這樣了",0,0,0,0,0,0
禾豐鐵板燒 (家樂福嘉義店),台式,"有一年來 印象非常深刻
年輕員工一直聊天
送上來 我的肉片完全沒炒進去......
也懶的說了 黑名單",0,0,0,0,0,0
禾豐鐵板燒 (家樂福嘉義店),台式,"跟媽媽去吃，叫兩份說要加辣，結果我媽的那份送來真的連一點辣椒的殘影都沒有(我的那盤還有放辣椒對比明顯)，吃起來認真沒辣，外場服務員還很不客氣的說：「有啦這個是辣的」
當下我們態度也沒不好，我也怕麻煩到服務員，也沒叫他們重做，他們切了生辣椒給我們，沒炒過就配著吃真的很母湯.. …",0,0,0,0,0,0
禾豐鐵板燒 (家樂福嘉義店),台式,"菜的份量少，還可以接受，可是加點的菜味道怪怪的，品質不好
晚上六點進去用餐，白飯不知道放了多久都有味道了也不更換，湯也是常溫不加熱，店員態度冷漠，看到媽媽自己帶孩子也不願意幫忙拿一下兒童座椅，全程站在旁邊冷眼旁觀，品質跟服務都很差勁，絕對不會再去吃了",0,0,0,0,0,0
禾豐鐵板燒 (家樂福嘉義店),台式,餐點還好，湯匙整桶有一半以上都沒洗乾淨，請服務生重新清洗，洗完也沒擦乾就又放回去，不會再來～～,0,0,0,0,0,0
禾豐鐵板燒 (家樂福嘉義店),台式,"冷氣不冷、服務生態度不佳、出菜也出錯
明明點不辣送來的菜卻是辣的
問服務生菜怎麼還沒來只隨便回答說要再等一下 …",0,0,0,0,0,0
禾豐鐵板燒 (家樂福嘉義店),台式,真的是沒有很好，白飯與湯確實是可以吃喝到飽，但小胖主廚心不在焉，荷爾蒙發作，是出菜速度超慢的主因，也忘記了服務客人的態度，雖然價格不高但確凸顯了cp值低落。,0,0,0,0,0,0
禾豐鐵板燒 (家樂福嘉義店),台式,"炒菜油噴到我 痛死

態度又差 …",0,0,0,0,0,0
禾豐鐵板燒 (家樂福嘉義店),台式,點了雙人餐 竟然不事先告知雞腿排只有幾塊肉，完全看不出是雞腿排，爛透了，比我們在台北常吃的鐵板燒還貴，量還少，真是弱爆無下限,0,0,0,0,0,0
禾豐鐵板燒 (家樂福嘉義店),台式,呃...鐵板師傅為什麼對女服務員態度這麼差？餐盤也用丟的，那個聲音那個動作表情，我都沒胃口了,0,0,0,0,0,0
禾豐鐵板燒 (家樂福嘉義店),台式,"這家餐廳員工的素質很差，店員也很豬哥，一直往我朋友的胸部看，還有東西這麼少你跟我收這個價格? 反正這家店千萬不要來吃 超雷 ☻
東西不好吃就算了還要被吃豆腐 呵呵",0,0,0,0,0,0
禾豐鐵板燒 (家樂福嘉義店),台式,"就說不要辣還給我炒辣的
跟服務人員告知
還叫我把辣椒挑起來就好
是在搞我？",0,0,0,0,0,0
禾豐鐵板燒 (家樂福嘉義店),台式,"裡面有一個員工是怎樣...
問他有沒有營業他說 有啊（臉很臭
進去的時候菜單用丟的 不會再去吃",0,0,0,0,0,0
禾豐鐵板燒 (家樂福嘉義店),台式,速度超慢，工作人員還會兇工作人員，摔東摔西，超情緒化，東西也難吃，以後不會再來,0,0,0,0,0,0
禾豐鐵板燒 (家樂福嘉義店),台式,"不推薦這間鐵板燒請了一堆啞巴服務生
有看到客人當作沒看到，服務態度真的很差
有待加強訓練",0,0,0,0,0,0
禾豐鐵板燒 (家樂福嘉義店),台式,"冷氣不涼，上菜慢，上錯菜，菜難吃
優點只有……湯好喝",0,0,0,0,0,0
禾豐鐵板燒 (家樂福嘉義店),台式,非常難吃，服務又差，又貴。花錢受罪,0,0,0,0,0,0
禾豐鐵板燒 (家樂福嘉義店),台式,態度不佳 工讀生很不耐煩 又臭臉,0,0,0,0,0,0
禾豐鐵板燒 (家樂福嘉義店),台式,等超久的，東西普通。,0,0,0,0,0,0
吉祥鐵板燒,台式,"反應今天所有的菜都太鹹了，甚至主餐是超級鹹，外場及廚師竟然都沒處理的意思，一句抱歉都沒有，真的傻眼！
而且用餐環境烏煙瘴氣的很不舒服，真心不推薦！",0,0,0,0,0,0
吉祥鐵板燒,台式,第一次去吃，本來是飯沒了、等了好一陣子才等到白飯，結果飯又沒熟，向店員反應：「米心沒熟！」又等了一下子也沒看他們有要換白米飯的動作，就再問店員：「怎麼辦？」店員回應說只能這樣吃，我們不解問說：「要我們吃沒熟的飯？」於是問店員：「老闆是哪位？」接著直接跟老闆反應（第一次反應時，店員已經有跟老闆說了，有看到老闆試吃沒熟的飯，但是老闆也沒應對動作，也看到店員繼續裝沒熟的飯給外帶的餐），而老闆是一直到我們直接向他反應之後，才說要去買飯… …,0,0,0,0,0,0
吉祥鐵板燒,台式,把外送員當空氣等了快半小時拿不到餐問還要多久回答不出來 還在招呼其他客人 不想做平板可以關一關了,0,0,0,0,0,0
吉祥鐵板燒,台式,"物價上漲又沒多好吃
還要吃你女服務生的服務態度差的要死
還有冬瓜茶淡如水",0,0,0,0,0,0
吉祥鐵板燒,台式,"青菜完全沒味道，主餐又少。
服務態度不佳",0,0,0,0,0,0
吉祥鐵板燒,台式,原本只想給兩顆，但服務生態度蠻好多一顆；價錢普通餐點普通，店內環境很不行，生意很好，同一個問題被問了三次覺得煩。,0,0,0,0,0,0
吉祥鐵板燒,台式,東西蠻好吃的，但外帶自取現場到還要等，但是辣度全部都沒有分，希望店員可以把單看清楚一點再做,0,0,0,0,0,0
吉祥鐵板燒,台式,"服務很好，有時候比較晚去，也不會像某些店家一樣臭臉待人或趕人~~
餐點都很好吃，價格也不貴，不過整體比較偏甜一點，每次去口味都差不多，不像某些店家每次去吃味道都不一樣😑😑😑
甜點是冰火香蕉冰淇淋超級好吃😍 …",0,0,0,0,0,0
吉祥鐵板燒,台式,"今天去但抽風機貌似壞了，吃一半被噴滿臉油煙超不爽，扣一顆星
今天整桌都是油煙，回家衣服都是油味，還要洗，扣一顆星
肉裡面吃到兩塊碎碎的軟骨，以前沒有這樣，可能偶發事件，但還是扣一顆星
服務態度很好，菜的味道跟以前差不多，保留兩顆星",0,0,0,0,0,0
吉祥鐵板燒,台式,"整間煙味，選擇性出餐
點單點就算先到先點好的人也要等到套餐出完才會輪的到，不知出餐師父是什麼邏輯，難道點套餐的才是顧客，選單點的人代表什麼？",0,0,0,0,0,0
吉祥鐵板燒,台式,"可能人太多 太忙趕時間 導致肉還紅紅的就上桌 沒熟真的不敢吃
個人認為服務態度什麼的反而是其次
重點的是吃的食物要做確實吧～",0,0,0,0,0,0
吉祥鐵板燒,台式,價錢有點貴，雖然飯，湯和飲料可以一直拿，可是希望店外面可以放價錢讓顧客考慮考慮,0,0,0,0,0,0
親咕韓式餐館,韓式,"當天營業才打電話訂位訂到1.的很幸運
裡面大約6、7桌 蠻寬敞
佈置都很韓系店員講話也很韓 …",0,0,0,0,0,0
親咕韓式餐館,韓式,"我們進店的時候
店員幫我們帶位並給我們菜單
我們已經就坐 …",0,0,0,0,0,0
親咕韓式餐館,韓式,小菜好吃，可以一直續也可以額外購買回家。東西口味非常韓風，份量也足夠，服務員態度很好，只是外面不好停車。,0,0,0,0,0,0
親咕韓式餐館,韓式,老闆態度哪裡差我沒感覺,0,0,0,0,0,0
親咕韓式餐館,韓式,"今天點的餐有：
辣子雞/烘蛋/煎餅/小部隊鍋/泡菜鍋
餐點製作時間很快，沒有等太久 …",0,0,0,0,0,0
親咕韓式餐館,韓式,提前電話點餐要外帶，到現場竟然說單弄不見了，什麼都沒做，太誇張了吧！說要重新點餐，還要再多等至少30分鐘，根本就是在浪費時間，就是不想現場等才電話預訂啊，好好的家人聚餐就這樣被你們毀了！,0,0,0,0,0,0
親咕韓式餐館,韓式,"電話訂位，店內桌位不多
餐點不錯吃，店員態度很好
外面不是很好停車，騎機車前往比較方便",0,0,0,0,0,0
親咕韓式餐館,韓式,餐點好吃，推薦人蔘糯米雞湯！人員服務親切，非常有禮貌，但上菜速度偏慢（等餐等滿久的😔) …,0,0,0,0,0,0
親咕韓式餐館,韓式,鍋類的味道還不錯，但店員可能太累還是怎麼樣🥺說不要洋蔥跟蔥原本有說好結果來的時候全部都加好加滿😭😭 上菜速度也是有點慢 兩個鍋都吃完了蒸蛋跟煎餅都還沒來…煎餅中間太濕軟 不是我喜歡的類型 最後要打包也是又被店員遺忘了…😢😢 …,0,0,0,0,0,0
親咕韓式餐館,韓式,"1.別客人入坐服務人員馬上拿水上桌而我需要跟服務人員要才有
2.點一樣鍋物別桌客人服務人員上鍋後會拿出大插子和大湯勺並解說而我們需自理還要請服務人員幫忙拿湯勺
3.點餐時覺得服務人員記憶很好都不用筆記但出餐還是遺漏了
4餐點大至上還滿意就是服務待加強",0,0,0,0,0,0
泰泰小姐‧手沖泰式奶茶,東南亞,今天使用foodpanda訂餐兩次 都被店家取消訂單 第一次打去詢問店家 店家說還沒準備好  我問店家foodpanda什麼時候可以訂餐 店家說11:30 後來我重新在foodpanda下訂單 訂單已經成功了 但過了不久 又被店家取消訂單  在去foodpanda搜尋店家 店家已改為星期一才能預訂  我在打電話去詢問店家  foodpanda今天還會有嗎？店家說要中午12點30分後了  後來我跟店家訂餐店取  我問幾點可以去拿餐點  店家跟我說中午12點要趕做訂單給客人 …,0,0,0,0,0,0
豚將日本拉麵 (嘉義興業店),日式,煮麵的不知道在跩什麼 溏心蛋口感像茶葉蛋一樣 蛋黃熟透了 店內檸檬水難喝的要命！,0,0,0,0,0,0
豚將日本拉麵 (嘉義興業店),日式,"地獄拉麵的辣味溫和，可以促進食慾，又不會讓人的嘴巴和腸胃辣的受不了，覺得不錯吃！
接待和送餐的態度及速度都很好，有機會會想再二訪。",0,0,0,0,0,0
豚將日本拉麵 (嘉義興業店),日式,今天外帶兩碗拉麵，中午結帳的一位年輕男店員態度奇差無比，因為住在附近很常消費都沒遇到這種情形，這次過後不再去受氣,0,0,0,0,0,0
豚將日本拉麵 (嘉義興業店),日式,湯頭過於普通，麵條質佳，平日可免費加麵，煎餃不夠濃厚。氣氛好，翻桌速度快，但人多仍需等待,0,0,0,0,0,0
豚將日本拉麵 (嘉義興業店),日式,"用餐環境、氣氛良好，餐點中規中矩、份量超多！

若要假日八點過後用餐，建議訂位且註明位置（吧台或合桌）。",0,0,0,0,0,0
豚將日本拉麵 (嘉義興業店),日式,全面漲價後取消之前菜單中還滿受家人歡迎的若干麵種，原本要付費的飲料變成免費但非常難喝，店員態度也不算好，就不再去了。,0,0,0,0,0,0
豚將日本拉麵 (嘉義興業店),日式,一堆等外帶的，看到人進來也不會問，只顧忙自己的，還要被我大聲問說我的東西好了沒才要查，一次而已，不可能再去吃,0,0,0,0,0,0
豚將日本拉麵 (嘉義興業店),日式,"上餐速度很快
味道也都還不錯
飲料30元可一直續杯 不貴 …",0,0,0,0,0,0
豚將日本拉麵 (嘉義興業店),日式,服務人員態度非常不優，明明說沒有低消，點餐時還詢問怎麼餐點點這麼少份，告知有人還在想要吃什麼，還請沒點餐的人先到門口坐,0,0,0,0,0,0
豚將日本拉麵 (嘉義興業店),日式,"上菜速度慢態度又差
外帶比較慢點餐還提前兩組客人取餐
棒棒喲",0,0,0,0,0,0
豚將日本拉麵 (嘉義興業店),日式,自己送錯，態度還那麼差，最後竟然都還不覺得有錯，比 來碗拉麵還 難吃，不會再去吃了。文化店態度差，興業店更差。,0,0,0,0,0,0
豚將日本拉麵 (嘉義興業店),日式,店長的臉非常臭，服務的態度非常的差勁，好像似欠他什麼說不上來，就是令人失望。不會想再去消費。,0,0,0,0,0,0
豚將日本拉麵 (嘉義興業店),日式,員工衛生超差，用手捏鼻子打噴嚏又抓頭髮接著徒手抓高麗菜絲跟炸物，超噁心。,0,0,0,0,0,0
豚將日本拉麵 (嘉義興業店),日式,麻煩，櫃檯態度好點，有待加強👍 …,0,0,0,0,0,0
豚將日本拉麵 (嘉義興業店),日式,餐點一直有問題  態度不好,0,0,0,0,0,0
巴豆夭鍋物 (嘉義興業店),台式,服務真差，已經先打電話說要外帶在再自己去拿，跟我說2號等10分鐘就可以，沒想到10分鐘過後去拿餐點，一到後先收錢也沒給東西，結果等到20幾號，東西還是沒有拿到，問服務生結果還很兇回我做錯了再重做，還瞪人，這種服務品質真是無法接受,0,0,0,0,0,0
巴豆夭鍋物 (嘉義興業店),台式,"等了半小時 比我提早一分鐘點餐的另一個小姐東西都吃完了，也離開了 ，我還在等，去詢問原來東西已經做好了 一直沒送餐，拿到吐司已經是冷掉的～完全不想吃了😤 我一顆星都不想給
送餐來也沒有歉意的意思～ 😒 …",0,0,0,0,0,0
巴豆夭鍋物 (嘉義興業店),台式,"等了40分鐘餐點一點都沒動靜
進去催促後才開始做餐點 結果沒10分鐘就好了
一直做外送平台的單 完全不照號碼順序
想去的客人請三思",0,0,0,0,0,0
巴豆夭鍋物 (嘉義興業店),台式,內用跟外送都等很久，效率差，工作量抗壓差，沒幾個就可以讓貴店做不出來....麻煩要多久講出來，不要只會等一下或者騙在做了！,0,0,0,0,0,0
巴豆夭鍋物 (嘉義興業店),台式,東西是不錯吃，但實在不能接受等一個卡拉雞腿堡等快一個小時⋯點完餐先上了蛋餅和蔥抓餅，吃完了又等了10幾分鐘，去問櫃台第一次，我的卡拉雞腿堡好了嗎？跟我說正在做了，又過了10幾分鐘問了第二次，還是告訴我正在做，一直到第三次問為什麼等一個卡拉雞腿堡要等快一個小時，才告訴我沒做到，現在正在做⋯那為什麼第一次不說？浪費誰的時間⋯,0,0,0,0,0,0
巴豆夭鍋物 (嘉義興業店),台式,櫃檯人員收錢沒洗手 直接拿厚片看到有點不太敢吃 因為不知道還有沒有摸什麼東西？ 態度也很差,0,0,0,0,0,0
巴豆夭鍋物 (嘉義興業店),台式,"等有夠久，明明有畫蛋餅，卻都沒有來跟他講，直接讓我們重排。
沒有一個小時以上的空檔和足夠的耐心，不建議吃這一家店",0,0,0,0,0,0
巴豆夭鍋物 (嘉義興業店),台式,"點餐的時候什麼都沒說
送到桌上才說今天沒菜了喔這樣一碗60？？
換菜單也不告知客人一樣把舊菜單放在店內 等我們畫完之後才告知我們要重寫菜單 然後還漲價？？？？ …",0,0,0,0,0,0
巴豆夭鍋物 (嘉義興業店),台式,難得來嘉義想吃當地有名宵夜 結果叫外送卻等了快40分鐘  做不出來還按備餐完畢 整個興致都被打壞 真的做不出來請關平台 不要耽誤大家時間,0,0,0,0,0,0
巴豆夭鍋物 (嘉義興業店),台式,拜託生意太好做不出來可以關掉平台嗎，不要害外送員，等15分鐘一樣餐點都沒好是在哈囉？,0,0,0,0,0,0
