Name,Label,Comment,NonImportant,portion,service,environment,price,food_quality
左阜右邑 (嘉義新生店),台式,店員態度真的超級差，要不是要給星，連一顆星都不想給...,0,0,1,0,0,0
左阜右邑 (嘉義新生店),台式,"非常糟糕的用餐經驗
在非尖峰時間點餐，等了快一小時還沒來
問了以後才說馬上出餐，明顯是忘記 …",0,0,1,0,0,0
左阜右邑 (嘉義新生店),台式,"服務態度極差 餐點品質的不佳
客人量少 出餐速度極慢 詢問還要看店員臉色",0,0,1,0,0,0
騰之雞排 (嘉義北興店),小吃,莫名奇妙，垃圾弄了一地也不撿乾淨，叫了也不回頭。東西好不好吃不知道，員工水準請加強謝謝,0,0,2,0,0,0
騰之雞排 (嘉義北興店),小吃,東西好吃但需要等一點時間，點餐希望簡單提醒就好，過多的詢問會有推銷感覺👍 …,0,0,0,0,0,4
騰之雞排 (嘉義北興店),小吃,員工去倒垃圾，垃圾掉了一地還不撿乾淨，亂丟垃圾很沒品！,1,0,0,0,0,0
三樂便當,台式,"中午11點訂了三個便當，
有跟店家告知12點是公司規定的吃飯時間，
店家說要趕看看，說12:10分會送， …",1,0,0,0,0,0
三樂便當,台式,不懂這種店怎麼能生存，大概只能靠外送騙一次客人，然後再也不會光顧，評價不到三顆星店真的不是開玩笑的優秀。大家小心，五分鐘的車程收到冷冰冰的便當，打去投訴後只想裝死推託還一直狡辯說是外送員的錯，拖了半小時勉強再送一個來，後來不停的被電話騷擾要人改評價，如果剛開始好好做怎麼會有問題。再打來騷擾就報警。2.7的評價不是威脅別人改一個評價就能扭轉的，不改善不自我檢討，你們的評價只會越來越低而已。,0,0,1,0,0,0
三樂便當,台式,可以考慮買的，偶爾會有小意外的人搞錯菜或強迫給你不要的菜。,1,0,0,0,0,0
三樂便當,台式,用熊貓訂餐，店家都沒在看備註欄位，明明寫避免的菜色，他偏偏給你放進來。,0,0,2,0,0,0
三樂便當,台式,出餐極慢，等餐中還伴雜著老闆娘對員工的漫罵，覺得很糟,0,0,1,0,0,0
三樂便當,台式,外送的那個戴眼鏡阿姨很靠北邊走！,0,0,2,0,0,0
郭家火雞肉飯 (嘉義仁愛店),台式,新開的郭家雞肉飯，雖然沒有像文化路的排隊排那麼長，但是乾淨明亮，雞肉飯上的黃蘿蔔片很下飯，花椰菜🥦、過貓很清爽！翻桌率很快！用餐內用陸續滿桌，擠在門口的人很多！建議要發號碼牌才不會一團亂！ …,1,0,0,0,0,0
郭家火雞肉飯 (嘉義仁愛店),台式,桌子油油髒髒的，自己倒開水用衛生紙擦出一層黑灰，雞肉飯的飯很硬感覺米心沒煮透，肉也沒什麼味道，豬血湯的豬血吃起來太Q像假的，還有蒜泥白肉根本沒有蒜泥，附帶一塊超肥的部位，最後，燙菠菜也沒燙熟……送餐還送錯桌等很久😑😑 …,0,0,2,2,0,2
郭家火雞肉飯 (嘉義仁愛店),台式,"動作超級慢～～能體諒過年人對，但動作真個慢的可以…
已經站在櫃檯前10分鐘了，才要幫你點餐，外帶點完餐到取完餐，大約又等了30分鐘 …",0,0,2,0,0,0
郭家火雞肉飯 (嘉義仁愛店),台式,"4/5號來西部出差，下午到的時候沒什麼人
老闆娘很親切，也第一次吃到嘉義雞肉飯，感覺算不錯，雞肉飯跟肝連湯都很好吃，份量都很敢給👍👍👍 …",0,4,4,0,0,4
郭家火雞肉飯 (嘉義仁愛店),台式,"身為北部人覺得吃起來跟北部的沒有差太多，沒有特憋驚艷（這家郭家好像跟另一家郭家不一樣？）最大的差別在於cp值高太多了啊！！
過貓等小菜很嫩，環境也很舒服乾淨。",0,0,0,4,4,0
桃城雞排(中正創始店),小吃,"真的吃得太飽了
但經過了還是無法抗拒
點了一份中的鹹酥雞 …",0,5,0,0,0,0
桃城雞排(中正創始店),小吃,"事先先訂好餐。
因故有慢到，店家貼心來電提醒。 …",0,0,4,0,0,0
桃城雞排(中正創始店),小吃,"不知道貴公司是應該要先服務排隊的客人，還是先預訂然後從旁邊插進來的客人？
我們也是提前預訂的客人，但也是好好的排隊在點餐的人後面，我可以體諒現場人員忙碌，但我不能接受插隊，已經當下反應我們先到的，現場人員卻還是先處理插隊的，後續的回答是插隊的客人昨天就訂好了 …",1,0,0,0,0,0
桃城雞排(中正創始店),小吃,這麽鹹怎麼吃，拿去跟店員說說是雪花，鹽加太多承認很困難？還是換一份很困難？,0,0,2,0,0,0
桃城雞排(中正創始店),小吃,"接線員服務好 外送人員也貼心等了一下
椒麻雞醬很特別
炸全雞多汁不柴",0,0,4,0,0,4
桃城雞排(中正創始店),小吃,店員結帳臉有點臭，雞排味道普普,0,0,2,0,0,3
桃城雞排(中正創始店),小吃,"01-01……不巧遇到收銀機罷工，所以多等待了些時間，人員服務都還不錯
買了2組699餐，都沒給飲料，因為已要上高速公路就算了
小品炸物有點太乾了",0,0,3,0,0,0
桃城雞排(中正創始店),小吃,店員不專業，每次線上訂去都漏單,0,0,2,0,0,0
老乾杯 (嘉義耐斯王子店),日式,"服務-參差不齊。
首先接待的人員餐點介紹極不熟練，結結巴巴，敷衍了事，看穿著像是管理職級，好奇貴店的教育訓練。
第一位服務員小寶，服務五顆星，肉烤的很剛好，還很會尬聊，可惜到一半就下班了。 …",0,0,2,0,0,3
老乾杯 (嘉義耐斯王子店),日式,"非常不推，兩人吃起來都要五千多。這種價位在我這平民百姓來說應該是頂級吧（？
食材裝潢氣氛絕對沒問題，有問題的是態度與服務，整場只有急促的塞餐，五千多的價位用餐時間一個半小時！呵呵
一個半小時我覺得ok是規定沒問題，問題是一直塞餐點烤肉給客人吃！ …",0,0,2,0,0,0
老乾杯 (嘉義耐斯王子店),日式,"食材不錯，但是服務完全不行，可惜了
整體而且，環境乾淨，包廂空間適當，讓用餐的心情鬆
但是，人力明顯不夠，桌邊服務品質很差，自己烤比較實在😅 …",0,0,1,4,0,3
老乾杯 (嘉義耐斯王子店),日式,套餐的湯一上桌已是冷的，肉質不錯，服務員大多稍顯生澀，烤肉技術應該另加強訓練，一分一秒看著肉的熟度過了很緊張⋯其他整體感受還算可以。給新人多點鼓勵，但是希望內部需多訓練再上場較合適！,0,0,3,0,0,3
老乾杯 (嘉義耐斯王子店),日式,"一流的食材、二流的代烤、三流的服務
欺負嘉義人沒去過別家的老乾杯還是別家的高級燒肉店嗎？來到嘉義能走鐘成這樣，代烤那什麼垃圾技術，各種燒焦，那麼好的食材都直接被糟蹋掉，其他服務也糟的可以，工讀生就算了正職感覺就是趕鴨子上架，雷到不行，另外每個流程前不需要把桌面做淨空嗎？沒準備好不要開店，還讓客人洗評價，丟臉。
這餐花八千根本吃來消業障的。",0,0,1,0,0,5
老乾杯 (嘉義耐斯王子店),日式,"昨晚去吃老乾杯 遇到專業又貼心的Howard
從桌邊服務就能看出他的認真
過程中我們一直問他問題 專業非專業的都問 …",0,0,4,0,0,0
老乾杯 (嘉義耐斯王子店),日式,"老乾杯在北部已經回訪過N次。第一次在嘉義新開的店用餐。也許因為是新店，大多服務生很明顯的是經驗不足：
訂位時間1點，1:03致電詢問是否會來用餐。從地下室搭電梯到店門後大約是1:08左右，雖然遲到是我們的不對，但接待小姐卻告知位置上的客人尚未離席。所以得請我們在等等至1:20左右。 如果是這樣為何在電話一開始的時候不先說明？ 不太理解我們趕著上樓到門口卻被告知位置尚未準備好的用意是什麼。 …",0,0,2,0,0,0
老乾杯 (嘉義耐斯王子店),日式,這天和全家人來吃飯，抱著滿滿期待，就在吃到一半時，因為吃太飽媽媽想去戶外區走走，但戶外吸菸區完全沒有裝燈，媽媽一踏進去沒幾步整個人匍匐在地，膝蓋手臂都流血了，整個下肢膝蓋瘀青，已經好幾天了還是無法正常走路，我請工作人員幫媽媽擦藥，但是服務也僅此而已，完全沒人承認餐廳沒有裝燈的問題，一句道歉都沒有，也沒有任何後續關心的表現，一個這麼頂級的餐廳服務僅此而已實在有些誇張，菜色沒有多好，好幾道和牛吃的很膩，卻要花好幾萬的價錢實在是非常不值得！這樣的服務實在是不配一個五星級餐廳，絕對不會再帶家人來第二次,1,0,0,0,0,0
老乾杯 (嘉義耐斯王子店),日式,嘉義店的服務極差！！！ 上菜把飲料放在桌角邊，也沒幫忙倒拼裝的飲料，杯子跟瓶裝的飲料放著就走了。上菜到客人面前也不幫忙整理桌上的盤子，還要客人自己端著喬桌上的空間。菜單的點法也很不一致，一下說可以點單人套餐，後面又說不行，一定要點雙人餐才有辦法出餐！？？？？？,0,0,1,0,0,0
老乾杯 (嘉義耐斯王子店),日式,食材不錯，環境不錯，但服務真的有待加強，烤肉技巧不是太熟練，整體普普，以這價位來說，失望居多。,0,0,2,3,0,3
老乾杯 (嘉義耐斯王子店),日式,"網路看到有商業午餐，但到了現場服務人員卻沒有拿出來介紹，問‘’不是有商業午餐？‘’
服務人員說是忘記拿了，才趕緊拿出來介紹
是真的忘記還是另有其他原因呢？
忘記的話真的不太應該喔，只想到要介紹一般餐點，商業午餐卻忘記了",1,0,0,0,0,0
老乾杯 (嘉義耐斯王子店),日式,吃完後終於能體會留一顆星的人的感受了，食材方面是不錯，但花這麼多錢的服務品質比幾百元的吃飽給人的感受更差！服務人員從一開始介紹菜單不詳細、各種食材的吃法太晚解說，東西都快吃完了才說可以搭配什麼一起吃，甚至來幫烤過程肉放著人就跑出去忙其他事情，本來是要放著給肉烤焦，但後來想說店員也是辛苦工作就幫忙翻面並按服務鈴提醒店家，總結嘉義店目前人手根本不足以應付客人，以後不會再前往用餐了！,0,0,2,0,0,3
老乾杯 (嘉義耐斯王子店),日式,服務人員感覺訓練非常不佳，不管烤什麼肉都黏在網子上，然後常常肉放著就忘記來顧了，我自己主動翻面都偏焦了，服務生才過來，還有幾次是我們當時也沒很注意結果整塊肉燒起來，超級焦，只說一聲不好意思，但感覺不到任何誠意，牛胃本來就很小了，被他烤一個焦的地方剪一剪之後根本就是吃一個空虛，最後讓我最生氣的地方是⋯問有沒有停車，但沒有給停車卷，到地下室才發現，也懶得上去要了，服務極差，價格跟食材也不成正比，從7:00開始吃就一直忍給服務人員機會，但忍到9:30吃完只有更怒而已⋯⋯四個人吃快9000，但真的吃了一個空虛寂寞難受,0,0,1,0,2,0
老乾杯 (嘉義耐斯王子店),日式,這是我有史以來吃過最失敗最糟糕的一餐，欺騙消費者，服務人員服務不佳，內部服務人員訓練待加強許多，一開始點的餐點價格最後卻變成另一個價格，那請問我們前面看菜單點我們想吃的意義在哪？那就直接無菜單料理不就好了？？服務人員利用話術來更改點餐內容及價格，非常可恥！呼籲要用餐的人員三思，沒必要花這種冤枉錢。,0,0,2,0,0,0
老乾杯 (嘉義耐斯王子店),日式,用餐速度慢到不可思議，5:30吃到9:00，1人服務11個人，對不起人均價2500應有的品質，不主動問服務員連杯茶也沒有，還以為只能點飲料。,0,0,2,0,0,0
老乾杯 (嘉義耐斯王子店),日式,"食材滿分，但服務人員態度很糟糕應對禮儀不足，我先生預訂L型包廂卻說我們沒訂到，還要拿出通話錄音證明，店員和主管腦子是不是有問題，說是別人訂走，前後搞了20分鐘，最後才讓我們進去，根本睜眼說瞎話
一次店，嘉義店的人員真是打壞老乾杯這塊招牌",0,0,2,0,0,5
阿榮師啤酒鴨 (嘉義中正店),台式,吃過之後跟部分評價說的差不多～沒有特別出色的，服務也很冷冰冰,1,0,0,0,0,0
阿榮師啤酒鴨 (嘉義中正店),台式,"點餐時就明顯感受到店員的不耐煩，今天工作累了嗎？儘管外帶的作業時間不長，都能感覺的出來服務並不是很友善，是不是與評論＂服務態度優＂的網友遇到的是不同批店員？

外帶窗口看進去就是工作台，店員夾的食材掉出了桌面，夾了半天又夾回碗內，看到胃口有點被打折了。 …",0,0,2,0,0,0
阿榮師啤酒鴨 (嘉義中正店),台式,"一次店⋯全部料理沒有一樣是熱的⋯然後服務人員口罩也沒有戴好⋯

滷肉飯的毛豆是酸的⋯ …",0,0,0,2,0,1
阿榮師啤酒鴨 (嘉義中正店),台式,"2/27那天中午去吃 人也不算多 一到不用等就有位子了 東西不錯吃，價格也不貴！
但是米糕裡面竟然有蟑螂腳 因為沒有拍照所以只扣一顆心 相信當天的服務員應該也是怵目驚心吧 希望店家可以好好改善",0,0,0,0,3,2
阿榮師啤酒鴨 (嘉義中正店),台式,今天點了外帶北平蔥油餅，餐點尚可，但當餐點做好，未有顯示號碼燈跟叫號，讓客人在外面乾等，我不能理解發號碼牌的作用是什麼？,0,0,2,0,0,3
阿榮師啤酒鴨 (嘉義中正店),台式,"櫃檯收費的一臉不耐煩是怎樣
欠你很多嗎？在你祖墳撒尿了嗎？
帶朋友來嚐鮮都說看了櫃檯的態度都想走人 …",0,0,1,0,0,0
阿榮師啤酒鴨 (嘉義中正店),台式,店員有發現發票的統一編號沒打好，也沒重打也不提一字　訓練需確實，另一名店員態度良好，後來有幫忙換發票,0,0,4,0,0,0
阿榮師啤酒鴨 (嘉義中正店),台式,"服務態度極差

啤酒鴨可以 一次店",0,0,1,0,0,3
阿榮師啤酒鴨 (嘉義中正店),台式,"星期日中午兩點進入店內想內用就被告知只能外帶
店內明明還有客人在用餐
接待店員面無笑容強調到兩點半休息
一整個心態不想接待",1,0,0,0,0,0
阿榮師啤酒鴨 (嘉義中正店),台式,口味尚可 看評論說服務態度不佳 實際造訪後 櫃檯人員態度差 臉很臭 花錢買氣 何必？欠妳錢嗎？ 如果不想受氣 造訪時真的要三思一下,0,0,1,0,0,3
阿榮師啤酒鴨 (嘉義中正店),台式,"點餐要特地走到外面
店員沒有很忙還能滑手機餐點卻要自己端",0,0,2,0,0,0
阿榮師啤酒鴨 (嘉義中正店),台式,東西不錯吃但份量太少然後櫃檯戴胖胖的女生態度有夠差好像欠她錢一樣,0,1,1,0,0,3
阿榮師啤酒鴨 (嘉義中正店),台式,"無法勾選出貨與到貨日
還沒回覆就直接出貨
客服服務也不好
超級傻眼",0,0,2,0,0,0
阿榮師啤酒鴨 (嘉義中正店),台式,"食物好吃…
但櫃檯服務非常爛，進去用餐被瞪了一下，點餐時口氣還不好
知道服務業很辛苦，但沒人逼你去上班",0,0,1,0,0,4
阿榮師啤酒鴨 (嘉義中正店),台式,東西不錯吃但櫃檯店員態度不佳好像欠他很多一樣,0,0,1,0,0,3
阿榮師啤酒鴨 (嘉義中正店),台式,"綁馬尾服務人員
看起來很像工讀妹妹態度有夠差",0,0,2,0,0,0
阿榮師啤酒鴨 (嘉義中正店),台式,你最爛！服務超爛！囂張什麼？你開的長久？我信你個鬼,0,0,1,0,0,0
阿榮師啤酒鴨 (嘉義中正店),台式,東西好吃，扣分是因為沒什麼客人的時段，點餐人員態度超差,0,0,1,0,0,4
阿榮師啤酒鴨 (嘉義中正店),台式,現在疫情嚴重...眼睜睜看著幫你製作餐點的廚房人員完全沒戴口罩拿出來給櫃檯，櫃檯小姐口罩拉到下巴的拿餐點給客人.....旁邊還有一個陪同員工聊天的朋友也完全沒戴口罩，難怪都沒人敢內用 希望不要這樣子因為你們餐點是好吃的。,0,0,0,2,0,4
喵嗚屋,小吃,自從板娘去二店換人顧後變得有夠差 從進去到結帳臉臭從頭到尾 講話也很不耐煩 一直叫客人看ig 介紹活動也介紹的不清楚 調飲也變不好喝,0,0,1,0,0,2
一甲子傳統豆花 (嘉義中正店),甜點,花生在豆花里煮到這樣嫩香的狀態，太神奇了。,0,0,0,0,0,5
波里手作早午餐,歐美,動作稍慢，做餐人員跟結帳人員沒分開，一手抓錢一手拿生菜做三明治（沒戴手套徒手抓），煎台沒帶口罩還聊天聊的很開心，生菜等等也都是放在室溫沒在冰箱，整體而言衛生有待加強,0,0,0,2,0,0
波里手作早午餐,歐美,"太誇張了，上架熊貓後還不給點餐。直接取消。
打電話過去，說可以再點，然後立馬取消營業時間。",1,0,0,0,0,0
波里手作早午餐,歐美,第一次來買，叫號取餐然後沒給取餐單號，等了30分鐘後才告知我的外帶餐點被別人拿走了???????,0,0,2,0,0,0
波里手作早午餐,歐美,"態度很差 餐點不合口味
吃完一肚子氣",0,0,2,0,0,2
小飛象早午餐,台式,用餐環境乾淨整潔 出餐還不算慢 餐點好吃 其實有特色餐點半隱藏版 但是這次沒有點 下次再來點點看 吃吃看,0,0,3,4,0,4
小飛象早午餐,台式,"建議老闆煎台可以戴口罩或透明塑膠墊片。吃ㄅㄧㄥ🐺個人我主觀不是很好。
店內有冷氣，送餐快，評價用料也實在 …",1,0,0,0,0,0
小飛象早午餐,台式,店家態度差對外送人員的態度更差這種態度差誰想去吃🙄🙄🙄🙄🙄🙄🙄🙄連一顆星都不如 …,0,0,1,0,0,0
小飛象早午餐,台式,老闆手腳很慢，吃個早餐要等快一小時呦🐶 …,0,0,2,0,0,0
小飛象早午餐,台式,超慢的⋯⋯等到都餓死了,0,0,1,0,0,0
四海脆皮臭豆腐,小吃,"店家在那邊吵架，完全不理會顧客需求，結果臭豆腐沒有附醬，還不知道有沒有熟，吵架就不要接單了啊，不然請好好把生意做好再吵好不好啊？吃個飯而已也要掃到颱風尾，我有付錢欸莫名其妙！！！！！
老闆就叫老闆娘你做了，老闆娘態度到底在差什麼的啦，你如果商品有做好還另當別論，態度差醬沒附，一直吵一直吵，莫名其妙欸，誰吃臭豆腐不加醬的啦氣死欸！！！！ …",0,0,1,0,0,0
四海脆皮臭豆腐,小吃,東西不難吃，但服務態度真的不ok⋯⋯,0,0,2,0,0,3
四海脆皮臭豆腐,小吃,動作真的很慢，等好久,0,0,2,0,0,0
家香魯肉飯,台式,飯是還好也不是很好吃，問題是老闆態度非常非常不好，來吃個飯還要看你臉色,0,0,1,0,0,3
家香魯肉飯,台式,"飯好不好吃很重要
但老闆態度更重要
希望新的一年老闆態度可以好一點
不然很影響去買得慾望",0,0,2,0,0,0
家香魯肉飯,台式,取個餐 被老闆罵髒話,0,0,1,0,0,0
峇曼滷製所,小吃,假日周邊全滿，抱著實驗的精神進來，雞肉飯買二送一，說實在令人驚艷，這個雞肉飯完全不用促銷，只差在名氣而已，很不錯。但滷味醬料味道有點淡，有透、醬再濃一點就好。,1,0,0,0,0,0
峇曼滷製所,小吃,價格比一般關東煮滷味店還貴，備餐動作超慢，還會忘記客人的餐點，服務亂七八糟,0,0,1,0,2,0
初八麵食堂,日式,"生意太好時服務態度打對折，在這裡用餐幾年來感受最不好的一次。
1.家人結帳時想把找的1元湊成5元跟店家換整數銅板，得到對方一句：我很忙耶。
忙可以用很多種方式表達，也可以直接拒絕，店家卻選擇用最極端的言語做表達。 …",0,0,2,0,0,0
初八麵食堂,日式,"環境：用餐環境優，但因為湯麵幾乎都有蝦，雖然桌上都有擺放小垃圾桶很貼心，但如果每桌也放上衛生紙會更好！
上餐：上餐速度太慢，坐下後等了半小時才吃到。
食物：覺得拉麵跟日式拉麵有點差距，比較像台式拉麵。點了豚骨口味但沒什麼豚骨味，反而因為配料都是海鮮的關係變得很像鍋燒海鮮麵。 …",0,0,2,4,0,0
初八麵食堂,日式,"一進去就不知道店員阿姨態度在差什麼，國語也講不好，根本沒人知道她想表達的意思。（好多人說她態度差，看來她是老闆囉？！）

看了看菜單餐點又很普通，實在覺得很不爽所以一行人就離開了，現在才來看評論，原來也有人遇到一樣情況，還好那天直接離開 …",0,0,2,0,0,3
初八麵食堂,日式,說等15分鐘變45分鐘，在後面點餐的（一樣也是拉麵）還比較早送到，還不只一組，很爛,0,0,2,0,0,0
初八麵食堂,日式,"因為google評價高所以去嚐鮮
中午用餐人潮蠻多，雖不至於需等很久，
但外場人員對於安排座位的應對跟態度都讓人蠻不舒服的（態度、講話跟臉部表情都很不好） …",0,0,2,0,0,0
卡早起晨,歐美,"22/04/03  11.am
環境明亮
送餐快速 …",0,0,4,4,0,0
卡早起晨,歐美,當時有和店家反應問題，也知道一定是店家太忙碌了，服務業真的是不好做，後來店家不是只單獨送我反應的食物，是專程送一份餐點來，是該給很有誠意的店家鼓勵和肯定😊 …,0,0,4,0,0,0
卡早起晨,歐美,東西以早餐來說還算不錯，只是價格偏高，飲料就普普可以自由選擇，但是服務態度和教育訓練不良，漏單各店家都會，這也沒什麼，但是前台人員不誠實，且不據實以告，還還試圖以錯誤餐點蒙混過去，實在說不可取，不敢說是忠實客戶，但是也陸續買過幾次，建議要外帶的人現場務必確認餐點正確性再結帳，不然店員很有問題，提供錯誤餐點還不給退費，這簡直就像是提供不適合你口味的餐點來強迫你吃，依照民法這是給付不正確，不能強迫民眾接收才是，建議其他未來可能受騙的民眾請注意，就讓本人成為最後一個受害者就好，畢竟餐點不正確還不退費只好接受錯誤餐點再隨意選取符合金額的產品令人不悅。,0,0,2,0,2,0
卡早起晨,歐美,動作好慢，內用位置好少,0,0,2,0,0,0
卡早起晨,歐美,"很爛 客人在外面等
內用的客人吃完了 也不告知
馬的",0,0,2,0,0,0
卡早起晨,歐美,"送餐的態度很差 送錯餐連跟客人講個話都沒說直接走人 確定錯了才來說個不好意思 回收餐盤也是自助式 都自助了應該擦個桌子吧 進去就看到很多沒擦 後來聽我妹說點餐的態度更差
是卡早起晨受氣嗎 餐點是還不錯吃啦 但態度不敢苟同",0,0,1,2,0,3
卡早起晨,歐美,內用餐點等超級久的，都一直在做外帶的，請改善 不要只顧外帶單。,0,0,1,0,0,0
卡早起晨,歐美,早餐飲料等了快10分鐘才來...巧克力吐司超甜。,1,0,0,0,0,0
微風早午餐,台式,"如果有0顆星，我會送0顆！ 等了半小時跟我說再做了。我後面的至少5個客人都上桌了！ 結果是我們的一份正在做，另一份給別人吃了！

氣炸我們了！ 出來玩還受氣。  原本想說男老闆服務很好，結果服務很好的結果就是吃不到早餐，浪費遊客時間⋯ 那等的時間都夠我去前面的早安山丘吃了⋯",0,0,1,0,0,0
微風早午餐,台式,出餐速度偏慢 餐點普通 東西都快吃完了餐點還沒到齊⋯⋯⋯⋯,0,0,2,0,0,3
微風早午餐,台式,"真的很糟糕   店家自己漏單還理直氣壯
我坐著等了超過15分鐘  完全沒上任何餐
比我晚來十分鐘的客人們都已經送餐了== …",0,0,2,0,0,0
微風早午餐,台式,出餐很容易搞錯 奶茶給紅茶 不然就是忘了做客人的訂餐,0,0,2,0,0,0
微風早午餐,台式,等快一個小時單還沒做,0,0,2,0,0,0
濰克早午餐 (嘉義民生北店),歐美,餐點勉強可以吃，沒油煙味，吃個粗飽，有個涼爽空間聊聊天。不過有一些服務可能需要考慮一下 像 飲料要自費是合理的但也應該要提供水杯給人家承用水。,1,0,0,0,0,0
濰克早午餐 (嘉義民生北店),歐美,"餐點多樣，蔬果豐富，但注意主廚餐盤是沒有附贈飲料，以及菜單有平日與假日的區別，今日餐點是1/2軟法及主廚嫩雞沙拉，太陽蛋也可以提醒店員改全熟。
餐點多樣，蔬果豐富，但注意主廚餐盤是沒有附贈飲料，以及菜單有平日與假日的區別，今日餐點是1/2軟法及主廚嫩雞沙拉，太陽蛋也可以提醒店員改全熟。",1,0,0,0,0,0
濰克早午餐 (嘉義民生北店),歐美,寫下午2點打烊，但是下午1點到卻說提早打烊，也看到裡面還有其他客人在用餐，如果說是怕客人一個小時內吃不完可以告知客人，但直接這樣說已經打烊，這樣給人的感覺不是很好。,0,0,2,0,0,0
濰克早午餐 (嘉義民生北店),歐美,廚房管控真差，一個男員工完全都口罩拉到下巴，邊嚼邊作菜，還一邊講話,0,0,0,2,0,0
濰克早午餐 (嘉義民生北店),歐美,"餐點好吃，是常客。
但今天小桌客人我吃一半被強迫給大桌客人讓位，不開2樓座位。但下桌人超過2位就開2樓座位了。
之前一切都很好。 …",0,0,2,0,0,4
