Name,Label,Comment,NonImportant,portion,service,environment,price,food_quality
吉利石頭火鍋,台式,"今日來用餐 湯頭還不錯
但是一直送餐太慢….收盤子的速度倒是很快😂😂
這樣的感覺不是很好會讓吃飯的客人感覺壓力很大要吃很快…希望可以改進 …",0,0,2,0,0,3
吉利石頭火鍋,台式,"臨時想吃石頭火鍋，看見門口放著醫護人員九折優惠。提醒想要折扣的用餐客人要記得帶充滿細菌病毒的證件出門享優惠。
假日出門不會特別帶證件，提供其他證明被拒絕的感受不太好。",0,0,2,0,0,0
香奈鵝鵝肉町,台式,期待很久，但餐點貴貴的、肉切的薄薄的、食物本身沒什麼味道，覺得失望牙😓 …,0,2,0,0,2,3
炒鮮現煮鴨肉麵-新竹米粉,台式,"晚上去外帶看到老闆在外面抽菸完進去製作餐點，沒有戴口罩及先洗手就拿備料製作餐點，請改善注意衛生！！！
還有錢很髒，請先洗手再拿備料製作餐點！ …",0,0,0,2,0,0
老東家素食,素食,昨晚因原本要去的餐廳已打烊，臨時來這裡用餐。20:00多還客滿，只有老闆娘一個人，沒空收拾餐具。我們四人擠在一張小桌子，忙爆的老闆娘還主動抽空挪一張過來，讓人很感動。 …,0,0,4,0,0,0
老東家素食,素食,"東西不新鮮
湯的浮沫都會有小隻的蟲子，最誇張還有一次看到小蜘蛛，菜都老葉爛葉，鐵板的盤子周圍也都是焦污垢。
重點老闆娘態度不好 …",0,0,2,0,0,2
老東家素食,素食,"打電話先去問是否有開店 已經明確表示我要點清湯麵 結果5分鐘內到店跟我說沒有食材  已經要收店了  絕對不誇張  8點都不到跟我說收店   已經很多次碰到這樣的問題   一顆星都不推 非常不愉快的體驗
謝謝  態度麻煩再更好 不是你的仇家",0,0,1,0,0,0
老東家素食,素食,價格便宜，老闆態度很差，麵沒熟，飯過熟糊掉,0,0,2,0,4,2
老東家素食,素食,明明在我們到之前，店只有2個客人，也不是説很忙，點餐態度真是有夠差，不會再來第2次，花椰菜沒洗乾淨還有蟲,0,0,2,0,0,2
老東家素食,素食,原本打電話過去先點，結果到現場說沒聽到沒有做，後來現場重點，結果態度不知道在不爽啥小的，一個湯麵叫我等一個小時，不良店家,0,0,1,0,0,0
老東家素食,素食,"東西沒多好吃
態度差
看到比我晚來的人 …",0,0,2,0,0,3
老東家素食,素食,大老遠特地跑來 營業時間還沒到 晚上9點30分到卻告知打烊了,1,0,0,0,0,0
老東家素食,素食,難吃，態度又不好，不建議前往,0,0,2,0,0,2
老東家素食,素食,東西便宜但料理速度太慢。,0,0,2,0,4,0
二奶巷星馬叻沙,東南亞,"橙香百花油條非常厲害！

可是打卡了出示給老闆娘看回「好！」卻也完全沒有如告示牌說的打卡送小菜，感到困惑？ …",1,0,0,0,0,0
麥飯樂,台式,打電話預訂等了一個小時，到現場時才開始做，都優先出餐給外送平台就好，時間很多的人可以考慮來這邊吃喔！,0,0,2,0,0,0
麥飯樂,台式,點了2份炒飯 1份加辣  1份不加辣 都已經有標註好了 還能加錯份,1,0,0,0,0,0
麥飯樂,台式,吃個飯等1小時餐點才送到，外帶的一律優先拿，建議直接點外帶拿進去裡面吃，除非你有一個半小時以上的空閒，不然就別浪費時間來了吧,0,0,2,0,0,0
麥飯樂,台式,"營業時間到 打電話沒人接 就直接去現場點餐 都還沒客人 點完表示待會我再去拿   十分鐘後回去 結果我的還沒做。硬是又等了十分鐘
連我前面三組客人都比我早拿到餐！",0,0,2,0,0,0
麥飯樂,台式,"剛叫外送服務裡面剛吃一口就有頭髮 在給我誇張一點
是都不會檢查是不是？？？ 要不是不能po照片 我po給你看",0,0,0,0,0,2
麥飯樂,台式,外送上已經給我接受訂單了，過了十分鐘才給我取消！是什麼意思...,0,0,2,0,0,0
麥飯樂,台式,我是第一次去消費，感覺價錢公道，快炒動作快。,0,0,4,0,4,0
麥飯樂,台式,送餐速度沒辦法比一星更高了,0,0,1,0,0,0
麥飯樂,台式,客人多就漏單，桌子也久久才整理，放得桌上都是盤子,0,0,2,0,0,0
日日興羊肉嘉義旗艦店,台式,一顆星都不想給，態度差！第一次吃羊肉爐越吃越冷，電動門在那邊開來開去，到底在幹嘛🙄🙄點個餐有夠慢，送錯菜，反覆問不停搞什麼？沒點的一直上，有點的一直不來，至少等半小時以上😮‍💨😮‍💨比我們晚來都上湯，那我們這些散客該死.... …,0,0,1,0,0,0
日日興羊肉嘉義旗艦店,台式,散客延遲送餐，團客快速送餐，建議開大桌店員才會理人，餐點貴、量少、漏單、送錯桌、送過還反覆送餐、重點等很久，高麗菜菜都上了桌，鍋都要半小時才來，是吃當我們天竺鼠膩？,0,2,0,0,2,0
日日興羊肉嘉義旗艦店,台式,外帶點個餐，中年女服務員一下子要問點什麼一下子跟內勤交代事情，我都不知道服務員到底在跟誰說話，我看你直接給我畫單就好了啊，給人很不尊重的感覺！重點裡面只有一桌在吃！想說要帶朋友來吃，算了吧...還有，也是漏開發票...第一次也是最後一次，羊肉爐還有很多選擇！,0,0,2,0,0,0
日日興羊肉嘉義旗艦店,台式,"1.加點一碗白飯等了15分鐘，跟現場人員反映了2次，完全沒有動靜。第3次加重口氣跟較資深的員工反映才把白飯送來，要配飯的熱炒都冷掉了。貴店的員工訓練跟出餐邏輯要檢討一下吧?
2.漏開發票漏開發票漏開發票，很重要講三次。翻看之前的評論，漏開發票也是慣犯了。",0,0,2,0,0,0
日日興羊肉嘉義旗艦店,台式,1/22晚上7點多用餐，羊肉爐裡面吃到面紙，並不是一般桌上衛生紙，我並沒有想為難店家，所以只是請店家過來查看，但是櫃檯大姐一直告訴我們說面紙一定是在菜裡面，不會是原本的湯底裡面，所以換新的鍋及裡面三道菜，鍋裡的菜招待我們 …,1,0,0,0,0,0
日日興羊肉嘉義旗艦店,台式,出菜超慢，火鍋內點了帶皮五花肉+清瘦羊肉，但量少的可憐，又肉質稍偏硬，帶長輩來吃要注意可能會咬不動，另單點快炒的菜量只適合2-3人吃，雖然整體用餐環境不錯，但不會再來光顧。,0,1,1,3,0,2
火鍋世家 (嘉義尊爵店),台式,節日的這天來消費，生意非常好。人力感覺不是很充足，當然也可能是真的太多顧客了。外場有位女服務生，雖然很忙碌，要顧櫃檯、上菜、裝湯......等，但是還是非常客氣，並且臉上還都是笑容，讓人非常敬佩。原本肚子很餓，但是因為女服務生的關係，也都覺得沒關係，也不會想生氣！非常謝謝今天的女服務生！,0,0,5,0,0,0
火鍋世家 (嘉義尊爵店),台式,家人慶生定位五點半八大兩小。5點50完成點餐。六點半了 菜盤 單點料都已經出了。但是肉盤一份都出不來。環顧餐廳其他座位 發現其他客人也都沒有肉盤。是來到素食訓練餐廳了嗎？  我已經開始先吃冰淇淋了。,0,0,2,0,0,0
火鍋世家 (嘉義尊爵店),台式,"因為吃過屏東店所以是以屏東來評價

出餐速度慢 菜盤都丟進鍋裡煮滾了 肉才來 …",0,0,2,0,0,0
火鍋世家 (嘉義尊爵店),台式,"火鍋算好吃，菜盤也豐盛，跟店員玩遊戲中了一大盤的白蝦，超幸運又超開心的~
它有提供自助吧無限暢飲，最喜歡的是雞蛋也是無限量供應，希望這個好康的可以持續下去。",0,4,4,0,0,4
火鍋世家 (嘉義尊爵店),台式,湯頭不錯，肉品質很好，共鍋加收120元抵單點消費，服務態度很好，CP值滿高的一家火鍋店！,0,0,4,0,4,4
火鍋世家 (嘉義尊爵店),台式,"辛苦的工作人員 可能是老闆要省錢吧
內外場兩人 客人20個
12:45進場 13:00才能點餐 …",1,0,0,0,0,0
火鍋世家 (嘉義尊爵店),台式,"🌟3月6號更新：來內用了！生日還有送蝦子！好棒好吃好開心～我重新給回5顆星🌟

一直很喜歡這家，但員工訓練真的欠佳，有幾位態度非常消極，而且優惠不比以前了，希望能快點回到疫情前的盛況！↔️這個是一個多月以前外帶的評價 …",0,0,1,0,0,4
火鍋世家 (嘉義尊爵店),台式,食材新鮮、魚片好吃！！自助飲料種類多，雞蛋無限提供，但店員很忙碌，進門沒人招呼...加湯也要等😤 …,0,0,4,0,0,5
火鍋世家 (嘉義尊爵店),台式,價位算貴，肉非常的薄也很少，店員有掛口罩，但是不戴起來，而且口罩拉下來期間一直講話...,0,2,0,2,2,0
火鍋世家 (嘉義尊爵店),台式,"肉質不錯 340g的肉 完全無法滿足…
也希望服務人員 下次點餐 可以大聲一點 再重複一下客人的餐點，我想點的是170g的豬肉鍋，中間可能太吵雜或我講的不清楚，導致服務員點成340g的豬肉鍋..畢竟我也吃完了，我也有付錢離開，撇開這個問題，其他用餐還可以，但以價位，我會選擇涮乃葉 可以吃的更盡興，所以在這邊想吃肉吃得開心的 可以去吃到飽的火鍋店，
🤔🤔🤔肉質，醬料區 都還可以，但CP不高😳 …",1,0,0,0,0,0
火鍋世家 (嘉義尊爵店),台式,"砸招牌的店長就是最大的問題！導致員工訓練不足，顧聊天乾脆直接關門好好聊就好，還是因為只要遇到不順你們意的客戶人，就開始在後面大肆宣洩情緒呢？出餐慢影響到客人用餐心情，該可憐的是用餐的客人，還是你們的心情呢？
請停止惡性循環的員工訓練！ …",0,0,2,0,0,0
火鍋世家 (嘉義尊爵店),台式,前面的評價沒有騙人，肉真的要等超久才會來，我們7點20左右點完餐，湯底跟菜盤先來，但是飯等到八點才來，另外一個人的肉盤到八點半才來。肉的品質不錯，但絕對不會再光顧第二次了。,0,0,1,0,0,3
火鍋世家 (嘉義尊爵店),台式,"餐點好壞已經是其次
1、菜盤都快吃完肉才送來，你要教育新人請不要浪費在顧客的時間上，還可以聽到聊天內容了
2、吃到一半在餐桌旁拖地，感覺很差，趕客人？ …",0,0,2,0,0,0
火鍋世家 (嘉義尊爵店),台式,"是按座位點餐所以不會餐送到了
還要問是誰的
因為肉是現切的所以會等的比較久一點 …",0,0,3,0,0,0
火鍋世家 (嘉義尊爵店),台式,"第一次來也不會介紹菜單，店員就拍拍屁股走人
點餐也要客人請⋯用餐時店員都聚集在櫃檯（有幾個比較認真啦會來收盤子，但⋯也有收一成服務費）
結帳時，收費那個還坐著玩手機🤷🏻‍♀️是多麼不想收費啊！感受極差！是生意太好很跩？ …",0,0,1,0,0,0
火鍋世家 (嘉義尊爵店),台式,"服務態度非常有待加強 教育訓練很失敗
介紹菜單到後面服務生竟然說 就字面上的意思
⋯⋯看的懂還要妳來介紹？ …",0,0,1,0,0,0
莊家火雞肉飯,台式,"過年人潮不斷，動作還是很快速
本來要火雞肉片飯但說沒了不賣，只好點火雞肉飯，雞油充分表達自己非常不錯，其他也點燙青菜、苦瓜湯、油豆腐整個算起來150元，不太貴的簡單也不簡單的餐點，嘉義只吃過民主，所以嗯跟他比，我是投阿里山一票的，不論是停車、還是雞肉飯的表現都是阿里山火雞肉飯樂勝",1,0,0,0,0,0
莊家火雞肉飯,台式,店家雖然客人多但出餐效率非常快，不過桌面清理有時候就要稍等一下。,0,0,5,0,0,0
莊家火雞肉飯,台式,"前陣子外帶雞肉飯很好吃（可以要求多汁），
忙碌的時候便當不能選擇菜色很可惜。
但最近跟店家反應希望外帶要多汁一點， …",0,0,0,0,0,4
莊家火雞肉飯,台式,過年期間去，人人沒服務品質可以體諒，餐點還可以，就是座位不多，動線也沒很優。,0,0,3,2,0,3
侯老師東石蚵仔煎,台式,從民族路時期就會光顧的店，之前一直很喜歡。昨天去吃，蛤蜊湯有一顆蛤蜊都是沙子，湯碗底都是沙，我不想當奧客，當下沒有反應，仍吃完大多正常的蛤蜊。付完錢才好心提醒老闆娘，蛤蜊品質不好，畢竟一碗80元才十顆蛤蜊，不該這種品質。老闆娘只有「喔喔喔」回應，一句道歉都沒有！非常沒有待客之道！我也不要退錢或爭論什麼的，說聲不好意思也做不到？還有端菜的小姐，竟然把熱湯端到小孩面前，明明我面前就有空位，沒有基本常識，太誇張了。,0,0,2,0,0,0
侯老師東石蚵仔煎,台式,賣的東西可以，但服務品質超差。,0,0,1,0,0,0
侯老師東石蚵仔煎,台式,大碗滿意又便宜，只是出菜慢慢慢,0,4,2,0,4,0
侯老師東石蚵仔煎,台式,入內半小時後，才告知已無餐點，很無言,0,0,2,0,0,0
侯老師東石蚵仔煎,台式,不新鮮，服務差，不推,0,0,2,0,0,2
曹家牛肉麵 (嘉義民生店),台式,東西還不錯 服務真可怕 看那個老闆娘不戴口罩 然後包別的客人外帶 小菜用丟的,0,0,2,2,0,0
赤二,歐美,送餐速度偏慢，常常點了都沒上，甚至點了第三輪，第一次點的肉才上，火太小不好烤,0,0,2,0,0,0
赤二,歐美,"今日整體用餐體驗非常糟糕！！上餐速度很慢，又很常漏送餐點，送的份量少到感覺就很怕人吃，其中一個女服務員態度非常不好，但老闆的態度還算好。
照片是我們點了“五份”蛤蜊的數量，我們這桌有六個人，一開始最後一次加點的時候店員還問我們會不會太多吃不完，我非常明確的告訴她我們可以吃完，結果五份送來是來8顆？！事後反（爭）應（論）才願意補給我們！真的怕人吃不要開吃到飽！",0,0,1,0,0,0
赤二,歐美,第二次去吃，覺得很令人失望，重點我還特地推薦朋友跟我去吃，超級尷尬，小朋友沒帶口罩去自助區，邊吃冰邊挖冰邊玩，服務人員也無制止，冰淇淋區弄得有點不乾淨，雖然我們是最後一桌，但時間離打烊明明還有快兩個小時吧沒記錯的話，飲料冰品的部分連詢問還有沒有需要都沒有，就直接收掉了...一開始進店裡時詢問 朋友晚點到可以晚點再點嗎，直接回覆說 可以。可是等待朋友到來的時間竟然還算在用餐時間內...為何不事先告知說明清楚呢，如果是這樣我們就不等了直接點餐了，總之，跟第一次去用餐的時候 差太多了,1,0,0,0,0,0
赤二,歐美,"之前來用餐過一次服務態度很好
所以帶家人再來吃一次
沒想到服務態度爛到靠北 …",0,0,1,0,0,0
赤二,歐美,奔著泰國蝦而去的 ，果然沒讓人失望 確實新鮮度一流，肉也真的吃的出來品質很好👍機器人送餐真的讓我跟小孩耳目一新 超級可愛的🤣因自己的小孩吃飯速度非常地慢 我有自知之明😅也擔心會耽誤店家關店時間而盡量加緊吃飯時間了，，但店家沒有讓我有趕客人的感覺 態度也十分良好 謝謝您們 也不好意思讓你們等我們吃這麼久.. 下次定會再度光臨 感謝你們🙏 …,0,0,5,0,0,5
赤二,歐美,前幾天去吃了，發現無骨牛小排系列跟安格斯大牛排的品質真的很有問題_都是使用劣質重組肉，如果使用重組肉真的應該標示，顧客是吃的出來也看的出來的。非常失望。真的不知道4.2顆星怎麼來的？,0,0,0,0,0,2
赤二,歐美,東西整體普通在社群媒體上打廣告，整個文章都沒寫清楚到現場去才說那是另一個方案，事前沒打電話詢問也是自己的疏忽，要去消費的提醒一下要事前電話詢問清楚🙃 …,0,0,2,0,0,3
赤二,歐美,"食材新鮮
可是點的東西出餐時沒送到
反應三、四次才補過來 …",0,0,2,0,0,4
赤二,歐美,"乾淨 附近就有停車場
肉質新鮮、泰國蝦吃到飽是一個賣點
但是，服務態度很差！ …",0,0,2,5,0,0
赤二,歐美,線上點餐送餐慢且與實際點的份量嚴重不符合，火力小需等待很久,1,0,0,0,0,0
赤二,歐美,"10/18星期五晚上八點兩位
巔峰時間滿桌狀態
出餐速度算滿快的 …",0,0,4,0,0,0
赤二,歐美,餐點跟服務都很好，只是用餐2小時有點少，人數少燒烤時間很足夠，人數多的話就來不及烤完,0,0,4,0,0,4
赤二,歐美,門口沒有告示，服務人員也沒主動提起，只有在桌上一角放一張紙說目前缺水所以泰國蝦都改冷凍的，如果今天知道是冷凍的，貴店我完全不會想進去用餐，冷凍就算了，好歹也退冰再給客人烤吧，整隻結冰到底要怎麼烤....第一次遇到餐廳泰國蝦給整隻結冰的。,1,0,0,0,0,0
赤二,歐美,"為了泰國蝦吃到飽才會到此用餐
電話訂位時為什麼不主動告知現在泰國蝦不是現撈的
點餐上菜看到冷凍泰國蝦才看到桌邊有告示因為缺水的關係
這種處理方式讓人完全無法接受",0,0,2,0,0,0
赤二,歐美,泰國蝦不新鮮，肉跟殼都黏在一起，草蝦還比較好吃，上菜慢，過了一個小時，第一次畫的單都還沒出完，甚至沒出，問了才給，第一次吃到這麼火，服務態度也沒很好，有些感覺在瞎忙，菜也沒介紹是什麼肉，直接放桌上，人手不足，還看到內場一個沒穿圍裙沒制服的便服小姐在裡面，之後還出來結帳，觀感不佳，,0,0,2,0,0,2
野餐，日 (嘉義中興店),健康餐,"今天叫foodpanda 滿心期待，口味不錯。
但是但是後來發現有雞肉沒熟～有血水
是想幫助我瘦更快嗎……？",0,0,0,0,0,2
野餐，日 (嘉義中興店),健康餐,已回購好幾次，覺餐點乾淨清爽，但剛外帶時，ㄧ工作人員站在滿是餐食的餐盤前，竟大辣辣的拿著髮梳梳著頭，也不見其他工作人員制止，乾淨的背後竟是這樣！以後不會再光顧了。,0,0,2,0,0,4
野餐，日 (嘉義中興店),健康餐,電話叫餐，不讓人思考，急著掛電話，這樣服務可以改進!!,0,0,2,0,0,0
野餐，日 (嘉義中興店),健康餐,客服的解決方式讓人感到失望，記得餐點有問題一定要拍照喔！！！,0,0,2,0,0,0
朴大哥的韓式炸雞 (嘉義加盟店),韓式,"18：00現場訂購說21：15才能取餐，訂全雞餐後等到21：00至店取餐才告知沒有全雞餐了，詢問為何訂餐時無告知，店員說當日只有50份全雞，傻眼是都知道只有50份還一直接單，旁邊有位小姐也是到現場才知道她的全雞也拿不到了，變成只能訂小雞翅跟小雞腿@@,因為炸雞餐只有4種，其中2種是全雞，店員態度是很客氣，但系統key單50份算不出來？？餐點也不算平價...感受欠佳",0,0,2,0,0,0
朴大哥的韓式炸雞 (嘉義加盟店),韓式,第一天電話都沒接，到第三天終於撥通，結果到現場取餐，餐點做錯，又等了一陣子。辣炒年糕非常的奇怪，不是傳統中的那種醬，很像是泡麵湯加上年糕，很失望。黑醬ok，但沒有驚艷，就是一次店，不會再回購。可能是剛開幕的關係，顯得手忙腳亂。,0,0,2,0,0,2
朴大哥的韓式炸雞 (嘉義加盟店),韓式,我不太確定韓式炸雞和韓式炸醬麵應該吃起了怎麼樣，但並沒有讓我感到不好吃，服務態度也很好，還會想去,0,0,4,0,0,3
朴大哥的韓式炸雞 (嘉義加盟店),韓式,"我在店裡面站了很久，超過十分鐘，電話狂響沒有停過，但是店員就是不接電話喔！寧願聊天也不接電話，難怪這幾天怎麼打都打不進去。
所以要點餐的人得親自去店面買了。",0,0,2,0,0,0
朴大哥的韓式炸雞 (嘉義加盟店),韓式,"服務不行
進店店員只顧著聊天
等到畫完菜單才告知完售 …",0,0,2,0,0,0
朴大哥的韓式炸雞 (嘉義加盟店),韓式,看得出來店員真的很忙，電話響不停，雖然需要等待，但炸雞好吃很嫩，所以覺得值得！,0,0,0,0,0,4
朴大哥的韓式炸雞 (嘉義加盟店),韓式,還沒打烊就沒東西就算了，顧客進店的時候店員顧著聊天，顧客畫完單要結帳才說賣完了，這服務真是讓人不敢恭維,0,0,1,0,0,0
朴大哥的韓式炸雞 (嘉義加盟店),韓式,打電話不接，到場才告知點完餐要9:45才能取餐好歹也接電話告知一下 都到場了才在說 搞笑嗎,0,0,2,0,0,0
朴大哥的韓式炸雞 (嘉義加盟店),韓式,"請問有應徵店員嗎
我看只要聊天就有錢賺了 感覺蠻爽der",1,0,0,0,0,0
紅色經典香腸專賣店 (嘉義民生南��),小吃,大腸太軟爛、香腸沒很熟有腥味，老闆沒戴口罩ㄧ邊烤嘴裡不斷咀嚼東西還一直邊講話…….,0,0,0,2,0,2
紅色經典香腸專賣店 (嘉義民生南��),小吃,香腸肏灰搭，老闆態度差！打名片上的電話要先訂購，對方說 他現在人不再現場，不過現場有電話有營業，但不給你電話，要過去現場等候。那請問名片上印電話的意義是????浪費客人的電話錢嗎~~,0,0,2,0,0,2
紅色經典香腸專賣店 (嘉義民生南��),小吃,先提早快1小時預訂了.到店卻沒有烤.店家還不覺的什麼🤷🏻‍♀️..最後草草烤給你.有的還沒熟😤鹹豬肉還減量了..真糟糕👎👎👎 …,0,0,1,0,0,2
狀元廣東粥 (嘉義中興店),中式,拿出全新的500給店家，結果找的三百元是破掉的，要爛掉的，上面還有寫字，想說只有一張的話，也沒差，但三張都給要爛掉的100元，提醒大家如果只有大鈔，可以先在旁邊的超商找開。 真的感覺很差,0,0,2,0,0,0
狀元廣東粥 (嘉義中興店),中式,態度這樣很難生存喔！,0,0,2,0,0,0
狀元廣東粥 (嘉義中興店),中式,"我買了2次粥，店家態度都不太好，一次是要加粥結果沒加大，跟店家說僅說不好意思就結束了，害我另一個小孩的晚餐我要自己煮；另一次是小孩生病喉嚨痛買粥先打電話問價錢跟實際去拿的價錢不一樣，然後說不要胡椒結果還是撒了胡椒，打電話反應結果只說叫我撈起來就好跟不好意思就掛電話了，我話都還沒說完就掛電話真的很沒禮貌。
另一次我先生去點了廣東粥現場吃，結果豬肝酸酸的還有一個很重的味道，害我先生吃幾口就不敢吃了",0,0,2,0,0,2
一家人鹽酥雞,小吃,"打電話過去訂餐，說好等20分鐘
時間到了去現場又多等20分鐘，總共等了40分鐘才拿到我的餐點
看到現場點餐的人東西都比我早拿到 …",0,0,2,0,0,0
香香滷味,小吃,營業時間標註16:30但16:30過去卻還沒開始 那麼營業時間就該變更成17:00才對 並不是讓人白跑一趟,0,0,2,0,0,0
老攤燒肉粽&蚵仔煎,台式,第一次給一顆星就獻給貴店！服務態度極差！！！！！！！！！！一開始要外帶點餐，結果被大喊不要擋在那邊，然後我說我想點餐，阿姨態度很不好的直接喊「填單！！」，阿沒有筆是要叫我怎麼寫，而且只想單點一個品項是不能口頭接單是嗎？又不是客人很多的狀態，當場直接回覆我不想買了轉頭走人。結果看到Google其他人評論，好險這個店家的態度救了我的胃。不想做生意想自毀招牌也不是這樣做的吧。,0,0,1,0,0,0
老攤燒肉粽&蚵仔煎,台式,"爛 真的爛 服務態度真的爛到不行
吃旁邊的攤位 來外帶這家的東西 老闆直接說很忙無法出餐然後不理會！！？？這是什麼道理？",0,0,1,0,0,0
老攤燒肉粽&蚵仔煎,台式,剛去點了炒飯跟肉粽還有湯，結果看到店家從後面拿出一個便當盒，倒出炒飯，不到一分鐘馬上就又包裝起來要給我，我跟店員說不要了，店員回應我說因為假日關係所以都先炒起來放。炒飯速度很快，有需要先炒起來放嗎，挺誇張的。,1,0,0,0,0,0
老攤燒肉粽&蚵仔煎,台式,"阿婆態度極差 好吃的東西也變難吃
不高興就不要開店",0,0,1,0,0,0
老攤燒肉粽&蚵仔煎,台式,轉角的水晶餃..老闆娘脾氣差 ..還想做生意 呵,0,0,2,0,0,0
老攤燒肉粽&蚵仔煎,台式,店內有一個短髮微胖阿姨，講話口氣很急，很差，只是講錯要怎麼裝在那爭論，做生意講話不用口氣那麼差，沒有欠妳兇搞清楚，聽得脾氣快上來想當場飆罵她，菜單也寫的很亂根本不知道怎麼寫，寫錯還在那給我543，做生意態度，語氣是不會好一點哦誇張，很囂張，東西吃起來普通！,0,0,1,0,0,3
老攤燒肉粽&蚵仔煎,台式,"外送對菜單老闆就過來大小是要對多久
當然我也回敬回去，就說我在兇甚麼給了我負評，果然是地雷滿滿",0,0,2,0,0,0
老攤燒肉粽&蚵仔煎,台式,現在手腳很慢！服務耶變很差！回話的態度很囂張,0,0,1,0,0,0
老攤燒肉粽&蚵仔煎,台式,態度差到一個極點，是欠你多少錢，自己講話小聲，還要兇客人，是要講給鬼聽喔，餐點還真的不怎樣，滷肉飯吃起來是甜的。,0,0,1,0,0,3
老攤燒肉粽&蚵仔煎,台式,"東西超貴，難吃，態度極差勁，一顆星都不夠格，
炒花枝90元裡面只有5、6塊，太貴了吧！
滷肉飯、意麵、蚵仔煎味精放太多，還能存活下去真是佩服",0,0,1,0,1,2
老攤燒肉粽&蚵仔煎,台式,"今天點了一晚炒飯，似乎是先前外帶的客人不要的...，店員直接倒回鍋內熱一下就端上來給客人...
這樣的作法真的很不好
之前來吃都很滿意，但這次的作法確實讓我很失望，希望下次不要再有同樣的事情發生在
我身上了",0,0,2,0,0,0
